{
  "format": "ofti.case-bundle",
  "format_version": 1,
  "version": 1,
  "case_name": "cavity",
  "start_time": "0",
  "mesh_policy": "auto",
  "application": "icoFoam",
  "header_version": "v2512",
  "case_fingerprint": "sha256-selected-case-inputs",
  "run_manifest": "runs/20260629T225418Z_cavity/manifest.json",
  "run_manifest_sha256": "sha256-run-manifest",
  "build_digest": "sha256-build-section",
  "files": [
    {
      "path": "system/controlDict",
      "size": 42,
      "sha256": "sha256-example"
    }
  ],
  "warnings": []
}
